{
  "account": {
    "id": "acc_3qk2m7x9p4t8w1v6r5ya",
    "login": "svilen",
    "provider": "github",
    "provider_id": 1296269,
    "claimed": true,
    "email": "svilen@example.com"
  },
  "plan": {
    "name": "free",
    "source": "default",
    "status": "active",
    "expires_at": null,
    "grace_ends_at": null,
    "interval": null,
    "cancel_at_period_end": false,
    "covered_by": null
  },
  "trial": {
    "state": "ended",
    "started_at": "2026-09-04T09:00:00+00:00",
    "ends_at": "2026-09-18T09:00:00+00:00",
    "days_left": 0
  },
  "depth_cap": 3,
  "meters": [
    {
      "meter": "runs",
      "used": 4,
      "limit": 5,
      "resets_at": "2026-09-28T00:00:00+00:00"
    },
    {
      "meter": "reading",
      "used": 1,
      "limit": 3,
      "resets_at": "2026-09-28T00:00:00+00:00"
    }
  ],
  "orgs": [
    {
      "workspace": "workspace:github:9919",
      "login": "acme-corp",
      "plan": "free",
      "covered": false,
      "members_permission": true,
      "bot_runs": {
        "meter": "bot_runs",
        "used": 2,
        "limit": 5,
        "resets_at": "2026-09-28T00:00:00+00:00"
      }
    }
  ],
  "sessions": [
    {
      "id": "ses_web_1",
      "kind": "web",
      "editor": null,
      "created_at": "2026-09-18T09:00:00+00:00",
      "last_used_at": "2026-09-23T14:05:00+00:00",
      "current": true
    },
    {
      "id": "ses_ext_1",
      "kind": "extension",
      "editor": "vscode",
      "created_at": "2026-09-18T09:02:00+00:00",
      "last_used_at": "2026-09-22T17:40:00+00:00",
      "current": false
    }
  ],
  "offers": {
    "cancel_personal_pro": false,
    "legacy_link": null
  },
  "billing": {
    "customer": false
  },
  "mode": "shadow",
  "now": "2026-09-23T14:05:00+00:00"
}
